3679, flights from jfk or la guardia to cleveland
3680, what does code y mean
3681, does flight ua 270 from denver to philadelphia have a meal
3682, list flights from atlanta to boston on wednesday afternoon
3683, flight information on january twenty third 1992 from denver to san francisco
3684, do you have a delta flight to san francisco from denver on august thirtieth in the early morning
3685, i need information for flights leaving baltimore and arriving in atlanta
3686, show all flights philadelphia to dallas
3687, what does fare code m mean
3688, what is the lowest fare from denver to pittsburgh
3689, round trip flights from salt lake city to cincinnati nonstop flights if possible
3690, i'd like a twa flight from atlanta to pittsburgh with a stopover in fort worth dallas please
3691, what time does twa depart from boston to go to san francisco
3692, give me the earliest flight tomorrow from st. petersburg to milwaukee on a airline other than twa
3693, what is the abbreviation d10
3694, newark to cleveland
3695, show me all flights from pittsburgh to philadelphia which arrive before 8 o'clock am on wednesday
3696, list the flights from dallas to san francisco on american airlines
3697, what time does the earliest flight which goes from atlanta to denver leave
3698, list types of aircraft that fly between boston and san francisco
3699, show me the flights from boston to fort worth on the morning of july tenth 1991
3700, i'd like the cheapest one way fare from boston to san francisco
3701, show me all flights which leave pittsburgh tomorrow and arrive in baltimore after 5 o'clock pm
3702, what is the ground transportation available in the city of philadelphia
3703, i would like to make a one way flight from boston to atlanta
3704, do you have any flights united airlines from dallas to san francisco
3705, what is ua
3706, i would like to arrange a flight from denver to pittsburgh
3707, what airlines fly from st. petersburg to milwaukee and from milwaukee to tacoma
3708, how much does it cost to fly from boston to baltimore on a saturday
3709, on monday i'd like to travel from las vegas to detroit michigan
3710, show me all flights from kansas city to chicago on june sixteenth arriving around 7 o'clock in the evening
3711, boston to denver monday
3712, tell me about twa flight 539
3713, what is the smallest aircraft available flying from pittsburgh to baltimore arriving on may seventh
3714, i need a flight from denver to philadelphia
3715, what is the price of a one way fare from boston to denver on continental airlines
3716, what are the flights and prices from la to charlotte for monday morning
3717, show me the flights from boston to pittsburgh leaving wednesdays and thursdays
3718, show fares and flights from denver to oakland
3719, can you tell me the latest evening flight from atlanta to denver on july seventh
3720, tell me about ground transportation at san francisco
3721, i would like to know the flights from denver to pittsburgh leaving on monday
3722, list flights between denver and pittsburgh
3723, what flights are available from pittsburgh to baltimore on july twenty fifth 1991
3724, show me evening flights to baltimore
3725, what flights from chicago to kansas city
3726, i'd like to fly from denver to pittsburgh with a stop in atlanta
3727, what are the afternoon flights from atlanta to baltimore
3728, show me flights from san francisco to denver on weekdays
3729, show me the flights from dallas to baltimore in first class
3730, does delta fly from atlanta to san francisco
3731, show me the ground transportation at denver
3732, show me the list of us air flights between boston and dc
3733, display all fare codes
3734, what flights stop in atlanta before noon
3735, cheapest flight from memphis to miami
3736, show me all flights from denver to baltimore
3737, give me the cheapest round trip flight from dallas to baltimore
3738, what are the different classes that an airline offers
3739, i'd like to see all the flights with their fares from denver to atlanta
3740, does eastern airlines fly between boston and washington
3741, show me flights from philadelphia to san francisco on wednesdays
3742, i'd like to book an flight on american airlines from boston to san francisco with one stop in pittsburgh
3743, what kind of ground transportation is available in atlanta
3744, show me flights from boston to philadelphia on a monday
3745, what is the cheapest one way fare from boston to washington
3746, flights and fares from denver to oakland
3747, find me the cheapest flight from boston to washington
3748, what are the classes of service on twa
3749, what kind of aircraft do you have flying from boston to san francisco on august twenty seventh
3750, fine can you give me information on ground transportation in washington dc to downtown
3751, is there a nonstop flight from denver to san francisco
3752, i want a direct flight from oakland to boston that leaves on a wednesday
3753, what flights are available from boston to denver today
3754, san francisco to denver
3755, show me all flights from philadelphia to san francisco with one stop in dallas
3756, display all flights from toronto to san diego on us air stopping over in denver
3757, how much is a first class ticket from boston to san francisco
3758, oakland to philadelphia
3759, please show me all airports in denver
3760, list round trip flights between boston and oakland using twa
3761, show me the flights from san francisco to boston
3762, show me all the us air flights to pittsburgh between 12 and 4 in the afternoon
3763, i would like the evening schedule of flights from san francisco to washington
3764, what are the fares from dallas to san francisco on flight dl 217
3765, what kind of ground transportation is there in denver
3766, what delta flights are available to fly from philadelphia to boston
3767, can you show me the list of flights that fly from washington to san francisco via dallas
3768, what is the first flight from boston to dallas
3769, eastern flies from atlanta to denver what type of aircraft do you use before 6 pm
3770, show me flights from milwaukee to orlando on a thursday before noon
3771, does united have a flight from miami to washington dc on wednesday
3772, i want a flight from san francisco to denver leaving san francisco in the afternoon arriving denver around 5 in the afternoon
3773, what are the flights from boston to washington on october fifteenth 1991
3774, flights from denver to pittsburgh on wednesday
3775, how many people fly on a turboprop
3776, please list all flights into denver before noon on united airlines and northwest airlines
3777, what flights are available from denver to philadelphia on wednesday
3778, what flights are available from san francisco to pittsburgh on monday morning
3779, show me all flights from baltimore to philadelphia
3780, what is the fare on the thrift economy flight from boston to san francisco
3781, how can i get from the airport in pittsburgh to downtown
3782, is it possible for me to fly from baltimore to san francisco
3783, find travel arrangements for a round trip flight from boston to pittsburgh
3784, is there any ground transportation to the city in dallas
3785, from phoenix to denver on a monday
3786, what is the latest flight from salt lake city to st. petersburg
3787, now i'd like information on flights from denver to san francisco
3788, may i see all nonstop flights from st. petersburg to charlotte
3789, from baltimore to san francisco
3790, show me the airlines that fly from denver to san francisco
3791, round trip fares from denver to philadelphia less than 1000 dollars
3792, i would like a flight from philadelphia to dallas
3793, i need to fly from boston to baltimore please give me the times of your flights in the morning before 8 o'clock
3794, show me the flights arriving at love field from all other airports
3795, airports in new york
3796, could you tell me about flights from philadelphia to dallas the flights should leave philadelphia in the morning
3797, what airlines fly from toronto to san diego with a stopover in denver
3798, on november twenty third what flights are available between boston and denver on american airlines
3799, show me all flights from pittsburgh to dallas
3800, what flights from houston to milwaukee on friday on american airlines
3801, i want an early morning flight between philadelphia and pittsburgh on tuesday morning
3802, what is the cheapest round trip fare from atlanta to pittsburgh
3803, what is the first flight from boston to san francisco on saturday
3804, show business class fares on us air from boston to toronto
3805, show me round trip fares from new york to miami
3806, what is the first class fare from boston to dallas
3807, show me all flights from san francisco to washington dc
3808, i would like to fly united airlines from washington dc to denver colorado
3809, are there any flights from atlanta to baltimore
3810, i'd like a flight tomorrow from columbus to houston with a stopover in nashville
3811, i'd like to book the cheapest flight from atlanta to denver on august first
3812, show me all flights out of boston on june twentieth that have business class
3813, show me prices of flights from baltimore to dallas
3814, what ground transportation is available in charlotte
3815, a breakfast flight from denver to san francisco please
3816, how many stops are on all flights from boston to san francisco that depart before 12 o'clock noon
3817, i would like a flight from atlanta to denver
3818, are there any continental flights between dallas and boston
3819, while i'm in pittsburgh what ground transportation is available
3820, next sunday flights from miami to cleveland after 1200 hours
3821, show me the flights from baltimore to dallas
3822, what does fare code qx mean
3823, show me flights from miami to new york leaving on a sunday first class
3824, i would like to book a flight for august twenty seventh with us air from baltimore to oakland what flights do you have available
3825, in atlanta i would like information on ground transportation
3826, okay all right do you have a flight on united airlines from atlanta to washington
3827, please list the afternoon flights from charlotte to minneapolis
3828, coach class flights on twa from columbus to st. paul
3829, i want to fly from dallas to san francisco
3830, what is the latest flight leaving boston to denver
3831, do you have a flight from boston to san francisco with a stopover in fort worth dallas
3832, list all flights from baltimore to atlanta after noon thursday nonstop
3833, show me all prices of first class from baltimore to dallas
3834, list all day time flights from pittsburgh to boston
3835, show me all the lufthansa flights between philadelphia and denver
3836, show me round trip fares from baltimore to philadelphia
3837, i would like to fly from philadelphia to dallas
3838, please list for me the flights on united airlines between boston and denver
3839, what are the flights from milwaukee to orlando on wednesday night
3840, explain restriction ap80
3841, what flights are between dfw and oakland
3842, i want a flight from houston to memphis on tuesday morning
3843, what is the earliest flight arriving in charlotte from st. louis on friday
3844, give me us air flights for next wednesday from cleveland to miami
3845, show me your flights from atlanta to denver on june fourth
3846, i need information on ground transportation between airport and downtown in the city of boston
3847, show me all the prices of flights from baltimore to dallas
3848, round trip fares from denver to philadelphia less than 1000 dollars
3849, show me flights from baltimore to boston
3850, could you please give me information concerning american airlines a flight from washington dc to philadelphia the earliest one in the morning as possible
3851, show me all flights from baltimore or denver or pittsburgh that fly to philadelphia
3852, does continental airlines fly from denver to san francisco
3853, which flights on united airlines and northwest go through denver
3854, are there any thrift economy flights to san francisco from boston
3855, i'd also like to see a list of the flights from pittsburgh to atlanta
3856, please tell me the type of aircraft used from atlanta to denver before 12 o'clock noon
3857, show me flights from dallas to baltimore
3858, give me all flights from new york city to las vegas that arrive on a sunday
3859, ground transportation dallas
3860, what are the evening flights flying out of dallas and going to san francisco on american airlines
3861, what flights are there between nashville and st. louis which are nonstop and arrive after noon and before 8 pm
3862, what economy flights are available from dallas to baltimore on july twenty fifth 1991
3863, list all daily flights between boston and oakland using american airlines
3864, what are the coach fares from la to charlotte monday morning
3865, flights from baltimore to philadelphia please
3866, what types of aircraft can i get a first class ticket from philadelphia to dallas
3867, give me the flights from memphis tennessee to charlotte north carolina
3868, what is the price of a first class ticket from atlanta to san francisco
3869, show me all flights from boston to denver which arrive in denver wednesday before noon
3870, does continental fly from denver to san francisco
3871, list flights from denver to philadelphia
3872, please give me the flight times i would like to fly from boston to baltimore in the morning before 8
3873, show me flights from pittsburgh to philadelphia
3874, show me the flights leaving saturday or sunday from milwaukee to phoenix
3875, cheapest round trip airfare from tacoma to orlando
3876, i need a flight on air canada from toronto to san diego with a layover in dc
3877, list daily flights from denver to baltimore
3878, i want to fly from detroit to st. petersburg on northwest airlines and leave around 9 am tell me what aircraft are used by this flight and tell me the flight number
3879, which cities does united airlines service
3880, what flights are there from dallas to pittsburgh on monday morning
3881, are there any flights from denver to atlanta with stops in pittsburgh
3882, what does iah mean
3883, i would like to fly from pittsburgh to atlanta on us air at the latest time possible in the evening
3884, show me all flights from toronto
3885, i'd like information on continental airlines flights from washington to philadelphia
3886, list daily flights from oakland to boston using delta airlines
3887, show me all flights from philadelphia to boston on monday which serve a meal and arrive before noon
3888, what flights from pittsburgh to atlanta on wednesday morning serves breakfast
3889, i want wednesday flights from atlanta to washington dc
3890, what cities does continental service
3891, list all american airlines flights from phoenix to milwaukee on wednesday
3892, what ground transportation is available in san francisco
3893, does us air fly from washington dc to denver
3894, list the flights from denver to san francisco after 2 pm on a monday
3895, show me all the flights on delta airlines and twa that go to atlanta in the morning
3896, i want to go from baltimore to san francisco with a stopover in denver
3897, please give me the flights available from boston to pittsburgh on wednesday of next week
3898, show me the flights from san francisco to dallas
3899, what ground transportation is available in baltimore
3900, round trip houston to las vegas nonstop
3901, show flights from denver into san francisco
3902, what are the flights from boston to san francisco
3903, sunday's flights between tampa and charlotte
3904, show me flights from baltimore to dallas
3905, what airlines fly from burbank to denver
3906, list all flights from chicago to seattle on continental which depart on saturday and serve meals
3907, list all flights leaving denver arriving in seattle on saturday that depart after 1230 pm
3908, how do you get from the airport to downtown dallas please
3909, please list the tuesday flights from atlanta to st. louis
3910, i would like an early flight from la to charlotte monday morning
3911, saturday flights from las vegas to montreal
3912, show me boston ground transportation
3913, list all the flights from charlotte to atlanta that return around 7 pm
3914, show me first class round trip flights from new york to miami i want the cheapest first class fare please
3915, please list the flights from pittsburgh to baltimore arriving may seventh
3916, do the airlines still offer first class
3917, i need to know if there are any direct flights from st. petersburg florida to tacoma washington leaving preferably tomorrow morning
3918, how much is a us air boston to pittsburgh daily nonstop flight
3919, i'd like to book a flight from columbus to nashville please
3920, what flights from detroit to st. petersburg
3921, what airlines fly from dallas to baltimore
3922, what is the cost for these flights from baltimore to philadelphia
3923, show me the flights on delta that go through atlanta
3924, list the flights on sunday afternoon from oakland to dallas
3925, show me the earliest nonstop flight from dallas to houston
3926, i want to travel from pittsburgh to oakland around midnight could you give me the flights
3927, show me the flights from boston to san francisco
3928, what are the cities that american airlines serves
3929, is there a late afternoon flight leaving washington for denver
3930, i need one first class ticket from dallas fort worth to san francisco
3931, show me all the direct flights from atlanta to baltimore
3932, show me the monday flights from san francisco to pittsburgh
3933, please show me the return flights from miami to new york
3934, show me the cheapest flights from san francisco to philadelphia
3935, show me the price of all flights from atlanta to washington dc
3936, give me flights from pittsburgh to baltimore
3937, find travel arrangements for a round trip flight from baltimore to pittsburgh
3938, all right would you let me know type of aircraft united airlines is using on the flights from denver to san francisco i would like to know the type of aircraft that they use on these flights before 10 in the morning
3939, show me the flights from philadelphia to dallas
3940, what is the earliest flight i can get from baltimore to boston
3941, flights to baltimore
3942, hi i need to go from cincinnati to san jose california after 6 pm on saturday
3943, what is the flight number of the earliest flight between boston and washington dc
3944, are there any flights on us air from pittsburgh to atlanta on wednesday
3945, do you have ground transportation between airport and downtown in boston
3946, list all flights from baltimore to philadelphia
3947, all northwest flights with stopovers in denver
3948, i'd like to get a flight from washington to oakland with a stopover in dallas fort worth for september fifteenth
3949, are there wednesday morning flights between pittsburgh and boston
3950, what is the round trip cost of a first class ticket from boston to san francisco
3951, what's the lowest round trip fare from dallas to any city
3952, give me the flights from boston to san francisco leaving early today
3953, ground transportation in oakland
3954, please list pm flights from boston pittsburgh
3955, show me all flights from philadelphia to san francisco with one stop in dallas
3956, what evening flights do you have available from baltimore to philadelphia
3957, show me flights from los angeles to pittsburgh for tuesday
3958, what is the cheapest one way fare from any city to another
3959, i'd like to find a flight from charlotte to las vegas and make a stop in st. louis
3960, i live in denver and i'd like to make a trip to pittsburgh
3961, list all flights from baltimore to atlanta after 12 noon thursday
3962, show me the cheapest one way flight from san francisco to boston leaving san francisco after 9 pm
3963, give me all flights from boston to philadelphia next week arriving after lunch
3964, what are all flights from denver to philadelphia on saturday
3965, flight information on january twenty third from denver to san francisco
3966, i'd like to find the cheapest one way fare from baltimore to denver
3967, i need a flight on sunday from long beach to columbus
3968, what are the fares for flights from charlotte to newark on tuesday and wednesday
3969, show me the itinerary of the connecting flight from boston to denver that departs boston at 10 am
3970, find me a flight from atlanta to baltimore
3971, what are the flights and fares from atlanta to philadelphia
3972, i would like an early morning nonstop flight from new york to las vegas on february twenty eighth
3973, describe fare code qx
3974, what is the earliest flight on friday from washington to san francisco
3975, american flights from chicago to los angeles morning
3976, show all flights from pittsburgh to oakland
3977, list all flights from chicago to seattle on continental airlines which depart on saturday before noon and include a meal
3978, i would like the first flight into houston from dallas on march first and the last flight from houston to dallas on march first
3979, please give me ground transportation information for denver
3980, show me the united flights from bwi to denver
3981, what are the flights from chicago to indianapolis
3982, show me the fare for us flight 3357 from philadelphia to baltimore
3983, first class price san francisco pittsburgh round trip
3984, what flights are there from minneapolis to chicago
3985, all right now i need a flight from seattle to san diego
3986, what is your last trip on august twenty seventh from washington to boston
3987, i want to depart washington april twentieth to atlanta least expensive fare
3988, show me the first class fares from baltimore to dallas
3989, i'd like to fly from cleveland to indianapolis tomorrow morning as early as possible what's available
3990, i need to make a trip starting in boston going to dallas denver oakland and back to boston
3991, what flights are available from boston to denver on wednesday in early morning
3992, i want to make a round trip flight from washington to san francisco and return
3993, on united airlines flying from denver to san francisco before 10 am what type of aircraft is used
3994, lowest fare from san francisco to los angeles
3995, what flights go from philadelphia to dallas with a stopover in atlanta
3996, show me the flights from baltimore to oakland
3997, what does code qw mean
3998, are there any flights from new york to montreal canada leaving on thursday
3999, show me all flights from oakland to philadelphia on saturday which serve a meal
4000, list all flights from seattle on continental which depart after 430 pm
4001, i'd like the earliest flight information from boston to san francisco with a meal
4002, what is the cheapest flight from pittsburgh to atlanta leaving on october fifth
4003, show me the flights from atlanta to washington dc on wednesday night and thursday morning
4004, flights from milwaukee to orlando one way
4005, tell me about flights on american airlines from dallas to san francisco on june twenty ninth
4006, please show me the flights available from san francisco to pittsburgh on tuesday
4007, flight information from san francisco to pittsburgh
4008, show me all flights arriving at dallas
4009, show me flights from denver to washington dc on a wednesday
4010, what airlines fly between boston and atlanta
4011, i would like to fly from boston to baltimore what time are the flights in the afternoon
4012, please explain fare code f
4013, i would like to know flights on june fifteenth from long beach to columbus after 12 noon please
4014, list all flights that leave from baltimore or denver or pittsburgh and arrive in philadelphia
4015, what are the classes of service on lufthansa
4016, show me the flights from baltimore to boston
4017, okay what i'd like to do on this one is go from washington to atlanta i want a nonstop and i'd like to leave around 5 pm
4018, give me flights from atlanta to baltimore
4019, show me the flights from montreal to philly
4020, please list all flights from denver to philadelphia two saturdays from now
4021, does flight dl 323 dl 229 from boston to denver stop in philadelphia
4022, show me the flights from cincinnati
4023, yes what flights will be used on july seventh in the morning from atlanta to boston
4024, please give me the flights from denver to pittsburgh which leave in the morning on july second
4025, show me all flights arriving to denver from baltimore oakland and boston
4026, do any of the san francisco to boston flights leave on friday
4027, now i need flights leaving denver in the afternoon on wednesday and arriving in san francisco
4028, i would like to go from atlanta to denver on tuesday
4029, does american airlines fly from philadelphia to dallas
4030, what flights depart from charlotte to newark that leave in the afternoon or leave in the evening
4031, are there any flights available from baltimore to dallas monday afternoon
4032, what kind of ground transportation is available in denver
4033, fares and flights from baltimore to philadelphia
4034, flights from westchester county to san francisco daily
4035, i need to find a flight from philadelphia to san francisco that has a stopover in dallas
4036, find me a flight from boston to san francisco with a layover in denver
4037, show me the flights from pittsburgh to dallas
4038, show me flights from atlanta to washington dc on wednesday evening
4039, show flights from denver to san francisco
4040, what are the cities served by delta airlines
4041, what flights are there from atlanta to washington early on thursday mornings
4042, list all flights from pittsburgh to philadelphia
4043, i'd like a flight from st. petersburg to miami on that next thursday
