1118, list nonstop flights from baltimore washington airport to oakland that depart in the afternoon
1119, please list fares for all the flights from atlanta to philadelphia on august the first
1120, show me the flights that go from san diego to newark new jersey by way of houston
1121, what flights are there from dallas to pittsburgh on monday morning
1122, what kind of aircraft is used on the first class american airlines flight from philadelphia to san francisco stopping in dallas
1123, what is the cost of round trip ticket first class between oakland and atlanta
1124, i need flight information on saturday for a flight from philadelphia to dallas
1125, what night flight do you have from san francisco to denver on united on the evening of august twenty seventh
1126, what are the flights from philadelphia to dallas on october first 1991
1127, list all tuesday night flights from boston to denver
1128, what flights available between pittsburgh and baltimore on august eleventh
1129, i want a flight from denver to pittsburgh then from pittsburgh to atlanta then from atlanta back to pittsburgh back to denver
1130, give me a flight from newark to tampa on friday
1131, what are the flights from pittsburgh to baltimore
1132, list the american airlines flights from dallas to san francisco
1133, what afternoon flights are available from pittsburgh to atlanta on a weekday
1134, what does the abbreviation ua mean
1135, i'd like a flight on united airlines from dallas to san francisco that leaves after 815 am
1136, what is the fare on american airlines flight 928 from dallas fort worth to boston
1137, flights from indianapolis to seattle washington
1138, which airline is the cheapest to fly from dallas to baltimore on december twenty fourth
1139, how much is a round trip first class fare between boston and washington
1140, i'd like to find a flight from tampa to montreal that makes a stop in new york
1141, show the flights that leave philadelphia that go to atlanta that leave early on thursday morning
1142, show me the airlines for flights to or from love field
1143, how many flights does each airline have with first class service
1144, show me next wednesday's flights between phoenix and milwaukee
1145, show me flights from philadelphia to baltimore
1146, round trip air fares from pittsburgh to philadelphia less than 1000 dollars
1147, show me the flights from boston to san francisco leaving after 4 pm on friday
1148, what does code y stand for
1149, what is the cheapest round trip flight from denver to atlanta
1150, can you show me flights that are economy class from baltimore to dallas
1151, ground transportation denver
1152, what is the earliest flight from boston to san francisco that serves a meal
1153, what ground transportation is available at denver airport
1154, okay i'm sorry could you tell me what flights leave atlanta and arrive in philadelphia around 5 o'clock
1155, and how much does it cost to travel from boston airport to downtown
1156, earliest flight from atlanta to philadelphia
1157, what flights from indianapolis to memphis
1158, when is the first flight in the morning from boston to denver
1159, show me the nonstop flights from nashville to st. louis
1160, show flights from atlanta to baltimore
1161, where is general mitchell international located
1162, what is bur
1163, are there any nonstop flights from san francisco to boston on thursdays
1164, thank you for that information now i would like information on a flight on april sixteen from atlanta to philadelphia early in the morning
1165, i'd like flights going from boston to atlanta leaving on august sixth in the afternoon
1166, i need to fly from denver to san francisco tuesday
1167, what does ff mean
1168, i want to fly from milwaukee to orlando on either wednesday evening or thursday morning
1169, all flights from pittsburgh to philadelphia that arrive at 6 o'clock next tuesday
1170, list all flights departing from general mitchell
1171, show me the one way fares from san diego to miami nonstop
1172, show me the flights from atlanta to boston
1173, what are the delta flights from dallas to boston
1174, show me all flights from boston to dfw
1175, what is the departure time of the latest flight of united airlines from denver to boston
1176, show me the airlines that fly between toronto and denver
1177, on thursday i'd like a flight from st. petersburg to miami
1178, please find me a flight between boston and philadelphia that arrives in philadelphia close to 5 pm
1179, what northwest airline flights leave denver before noon
1180, from denver to baltimore
1181, i'm trying to find a flight from columbus to phoenix through cincinnati
1182, flight information between washington and denver on september third
1183, what flights go from boston to denver before 10 am
1184, flights from charlotte to baltimore
1185, what is restriction ap57
1186, please list all flights from dallas to philadelphia on monday
1187, list all united flights from boston to san francisco
1188, are there any flights from boston to san francisco with a stopover in dallas
1189, i need a flight from san francisco to pittsburgh from pittsburgh to new york and then new york to san francisco
1190, what flights from atlanta to st. louis on tuesday arriving around 230 pm
1191, show me the flights to love field from all other airports
1192, show me all flights from montreal
1193, is there a flight departing from san francisco and arriving in oakland on november seventh in the evening
1194, show me the flights from denver to westchester county
1195, can you tell me the latest evening flight from atlanta to denver on july seventh
1196, show me all flights from denver or philadelphia or pittsburgh to baltimore
1197, flights from las vegas to montreal
1198, does midwest express serve cleveland
1199, what kind of aircraft does delta fly before 8 am on august second from boston to denver
1200, list all flights arriving and departing at general mitchell international
1201, what is the cheapest one way fare from atlanta to boston
1202, okay i'm looking for a flight from tampa to st. louis leaving before 10 am any day
1203, what are all flights from boston to denver
1204, can you give me information on transportation from the airport in philadelphia to downtown philadelphia
1205, give me a flight from memphis to las vegas and new york city to las vegas on sunday that arrive at the same time
1206, what kind of airplane goes from philadelphia to san francisco monday stopping in dallas in the afternoon first class flight
1207, list all flights on continental departing on monday before noon from denver to chicago
1208, i would like to know the first class fare on a flight from baltimore to denver
1209, flights from newark to cleveland 5 o'clock pm daily
1210, what is the cheapest fare between boston and san francisco
1211, on tuesday i'd like to fly from detroit to st. petersburg
1212, find a flight from san francisco to boston on wednesday
1213, what is the cheapest flight from dallas to baltimore
1214, what flights are there from newark to seattle on saturday
1215, please list all the takeoffs and landings for general mitchell international
1216, please list the morning flights from kansas city to atlanta
1217, i want to leave boston at 838 and arrive in denver at 1110 in the morning
1218, i would like one flight from kansas city to st. paul arriving around dinnertime 6 pm
1219, list nonstop flights from baltimore to newark on wednesday before noon
1220, i'm looking for a flight traveling from boston to denver one way and the cheapest way possible
1221, what ground transportation is available at the boston airport
1222, what type of aircraft is used on american airline flight 315
1223, explain restriction ap please
1224, i would like a us air flight from toronto to san diego with a stopover in denver please
1225, what is the lowest fare from denver to atlanta
1226, what flights are there from new york city to las vegas
1227, how long does it take to get from kansas city to st. paul
1228, i would like a flight from kansas city to st. paul departing at 4 pm
1229, what is the round trip fare on continental 1291 from dallas to san francisco and return
1230, i want to go and take a plane in atlanta and fly to boston
1231, i'd like a flight leaving atlanta august seventh and arriving in denver colorado august seventh leaving in the afternoon
1232, show first flight from philadelphia to dallas
1233, list the flights from philadelphia to dallas on american airlines
1234, find a nonstop flight between boston and washington arriving in washington around 5 pm
1235, give me the continental flights from chicago to seattle on saturday morning
1236, what ground transportation is available in dallas tomorrow
1237, show me all flights from pittsburgh to boston both direct and connecting that depart pittsburgh after 7 pm
1238, show me the flights from pittsburgh to baltimore
1239, show me all the flights from montreal to detroit
1240, show me all flights from san francisco to la guardia nonstop
1241, show me flights from philadelphia to baltimore
1242, show me all the delta flights leaving pittsburgh between 12 and 4 in the afternoon
1243, could you please show me all flights from charlotte to milwaukee
1244, i'd like to find the earliest flight possible from san francisco to atlanta
1245, what flights are available on wednesday from atlanta to washington dc
1246, i would like information information on flights from san francisco to denver on thursday morning
1247, please list the flights from st. paul to kansas city on friday night that serve meals
1248, flights from chicago to denver on continental on saturday morning
1249, i need a return flight from chicago to kansas city leaving chicago around 7 in the evening on the day following next wednesday
1250, i would like the fare on the us air 1039 from denver to pittsburgh on april twenty
1251, what is the cheapest way to travel round trip from milwaukee to san francisco
1252, what're the lowest one way fares from denver to atlanta
1253, what flights are there from pittsburgh to san francisco on friday
1254, flights from la guardia to jfk
1255, please show me the return flight number from toronto to st. petersburg
1256, find me the earliest boston departure for atlanta and the lastest return trip from atlanta so that i can be in atlanta the longest amount of time but return to boston the same day
1257, an american airlines flight first class from philadelphia to dallas
1258, list the flights from houston to st. paul
1259, i would like to see the economy fares for denver to philadelphia
1260, what are the flights from kansas city to burbank on saturday may twenty two on america west
1261, flights from st. paul to houston
1262, show me the aircraft that canadian airlines uses
1263, which airlines have flights from san francisco to washington by way of indianapolis
1264, are there any flights from boston to san francisco which stop in washington dc
1265, all flights from boston to washington dc on november eleventh before 10 am
1266, denver to philadelphia monday
1267, nonstop flights denver to kansas city
1268, i would like direct coach flights from pittsburgh to atlanta
1269, what flights are there arriving in chicago on continental after 11 pm
1270, can you list all nonstop flights departing from st. petersburg and arriving in charlotte
1271, what is the type of aircraft for united flight 21
1272, can you tell me about flights from san jose to nashville on saturday afternoon
1273, please give me flights available from denver to philadelphia
1274, round trip air fares from baltimore to philadelphia less than 1000 dollars
1275, dallas to oakland saturday
1276, what aircraft is used on delta flight 1222 from kansas city to salt lake city
1277, i need to go from philadelphia to dallas
1278, how many flights does american airlines have from boston to atlanta
1279, only show continental flights
1280, what is restriction ap 80
1281, oakland to denver
1282, show me flights between new york city and las vegas on sunday
1283, can you tell me the flights on october fifteenth 1991 from boston to oakland
1284, what flights from chicago to denver in the morning
1285, what are the flights from washington dc to denver
1286, i would like an evening flight from pittsburgh to los angeles on june third
1287, from las vegas to phoenix departing in the morning
1288, flights from milwaukee to phoenix on saturday or sunday american airlines
1289, flights from boston to pittsburgh
1290, i'm looking for ground transportation in dallas
1291, is there a flight from atlanta to san francisco that stops over in denver
1292, what is the earliest flight between boston and washington
1293, first class american flight from philadelphia to dallas on wednesday
1294, i'd need information please on a flight from washington dc san francisco california
1295, i'd like flight information between boston and washington september third
1296, list daily flights from atlanta to denver
1297, all flights from baltimore to philadelphia less than 1000 dollars
1298, show me the flights from san francisco to boston on august thirty first
1299, show flights between boston and philadelphia
1300, what limousine service is in boston
1301, what are the flights from las vegas to burbank also on saturday may twenty two
1302, how many united flights are there to san francisco
1303, show me the flights into love field
1304, what are the rental car rates in san francisco
1305, san francisco to boston please with a stopover in denver
1306, i would like to see the flights from denver to philadelphia
1307, please list all flights on united airlines and northwest which go to denver
1308, i'm traveling to dallas from philadelphia
1309, list the total number of flights to all airports by delta
1310, i need to book a flight from newark to tampa on april fourth
1311, show me all flights between san francisco and philadelphia for september fifteenth
1312, all flights from san francisco to los angeles
1313, is there a flight on continental airlines from boston to denver
1314, what flight from denver to pittsburgh arrives earliest in the morning
1315, when is the earliest flight from boston to denver
1316, what's a flight that goes from baltimore to seattle
1317, what's the first flight from boston to san francisco
1318, please give grounds transportation at dallas airport
1319, what is the latest afternoon flight i can get from dallas to san francisco on first class
1320, what is restriction ap 57
1321, what is the earliest flight from boston that will arrive in denver
1322, what is the earliest arrival in salt lake city of a flight from toronto
1323, and what is the last flight from denver to boston for tomorrow evening
1324, please show all flights from philadelphia to denver airport next sunday
1325, all flights and fares from pittsburgh to dallas round trip after 12 pm less than 1100 dollars
1326, show me all fares between philadelphia and san francisco that are less than 200 dollars one way
1327, show me fares leaving on tuesdays from denver to dallas
1328, i want wednesday flights from atlanta to washington dc
1329, are they all nonstop flights from kansas city to st. paul
1330, okay show me all the flights to baltimore
1331, flights from pittsburgh to baltimore between 10 am and 2 pm
1332, i'd like a return flight from denver to atlanta evening flights
1333, american flights from cincinnati to salt lake city
1334, list all the flights that depart from general mitchell international
1335, minneapolis to phoenix on monday
1336, show me dallas ground transport
1337, what flights are available monday from san francisco to pittsburgh
1338, flights from pittsburgh to los angeles thursday evening
1339, i need to fly from washington to san francisco but i'd like to stop over at dallas can you tell me a schedule of flights that will do that
1340, what's the cheapest round trip fare between dallas and baltimore
1341, please list nonstop flights from las vegas to new york on america west
1342, i'd like to see flights from baltimore to atlanta that arrive before noon and i'd like to see flights from denver to atlanta that arrive before noon
1343, okay just on november twenty third i want to fly from atlanta to denver and i need to know what flights are available
1344, what kind of plane flies from boston to pittsburgh after noon
1345, flight from denver to salt lake city
1346, are there any other flights from boston to pittsburgh wednesday next week later than 5 pm
1347, flight information from oakland to denver
1348, i would like a flight between denver and san francisco leaving from denver in the afternoon and arriving at 5 pm it must be a nonstop flight
1349, what flights are there available from philadelphia to denver on wednesday with economy class
1350, is there a united airlines flight from miami to washington dc arriving around noon
1351, show me all the flights from new york to milwaukee
1352, what ground transportation is available in denver
1353, could i have a listing of flights leaving boston going to baltimore leaving wednesday after 2100
1354, what ground transportation is available in atlanta
1355, what is the cost of the air taxi operation at philadelphia international airport
1356, what does d s stand for for meals
1357, show all airlines with flights between denver and dallas
1358, first class round trip airfare from indianapolis to memphis
1359, how much does flight ua 297 from denver to san francisco cost
1360, i need a round trip flight from cincinnati to san jose california
1361, what northwest airline flights leave denver before noon
1362, show me return flights from cincinnati to salt lake city nonstop
1363, is there a flight leaving from boston to atlanta
1364, show me a list of flights on july twenty second leaving dc to dallas leaving dc after 6 pm
1365, my question is i want to go to san francisco and i live in denver and i would like to fly on united airlines do you have an early flight
1366, show flights from pittsburgh into san francisco
1367, what flights are there from dallas to houston
1368, show me all flights between boston and washington
1369, show me all flights from boston to denver which arrive in denver wednesday before noon
1370, list possible round trip daily flights between boston and oakland
1371, please show me airlines with service from boston to denver
1372, what are the fares for flights between atlanta and dfw provided by delta airlines
1373, show me one more time the first class fares from baltimore to dallas
1374, what are my choices of flights to get from charlotte to minneapolis arriving about 7 pm in minneapolis
1375, tell me the flights from baltimore to dallas
1376, i want to find a flight from boston to atlanta
1377, ground transportation between airport and downtown in boston
1378, what're the flights from memphis to las vegas that arrive on a sunday
1379, i would like to fly from dallas to san francisco on saturday and arrive in san francisco before 4 pm
1380, what are the flights from dallas to boston for tomorrow night or evening
1381, flight from denver to boston
1382, show me the flights from san francisco to dallas on continental airlines
1383, find me flights that are nonstop between boston and dallas
1384, show me the fare from dallas to san francisco
1385, i want to know what flights you have available coach or economy class from baltimore to dallas
1386, show me american flights from dallas to san francisco
1387, what is the cheapest flight from pittsburgh to atlanta one way
1388, show prices for all flights from baltimore to dallas on july twenty ninth
1389, what flights are available from dallas fort worth to atlanta
1390, looking for flights in toronto to san diego
1391, what do you have tomorrow after 5 o'clock from atlanta to san francisco
1392, what flight leaves dallas for atlanta on august twenty seventh in the evening
1393, list all flights from boston to oakland
1394, what's the latest flight from san francisco to atlanta
1395, philadelphia to boston monday
1396, i want a flight from los angeles to charlotte that leaves on a weekday morning
1397, ground transport in denver
1398, i would like a flight between denver and san francisco leaving from denver in the afternoon and arriving at 5 pm
1399, what ground transportation is available in baltimore for the day after tomorrow
1400, i would like an afternoon flight leaving tuesday san diego to indianapolis
1401, what is the earliest flight on thursday from atlanta to washington dc
1402, what is the latest flight leaving washington for denver
1403, find travel arrangements for a round trip flight from dallas to pittsburgh arriving after 8 pm before 10 pm
1404, give me a flight from charlotte to baltimore on tuesday morning
1405, i'm looking for flights from pittsburgh to philadelphia leaving before 9 am
1406, what is fare code qo mean
1407, what flights are there from baltimore to san francisco
1408, i would like to fly from salt lake city back to st. petersburg on wednesday
1409, i would like an afternoon flight from denver colorado to dallas texas
1410, how much is a limousine between dallas fort worth international airport and dallas
1411, can you list all flights from chicago to st. louis that depart after 12 noon
1412, afternoon flights from boston to san francisco please that leave in the afternoon
1413, i'd like flight information from dallas fort worth to boston on tuesday
1414, ground transportation in phoenix
1415, i want to go from boston to washington on monday morning
1416, display types of aircraft departing from cleveland to dallas before noon
1417, what do you know about car rental in denver
1418, flights from montreal
1419, what is airline nw
1420, display all flights leaving from toronto to san diego on us air laying over in washington dc
1421, i'd like a limo in denver on august seventh
1422, i would like to fly from dallas to denver on the morning of august twenty seventh leaving at 650
1423, i need a flight tonight from charlotte to las vegas with a stop in st. louis and i want dinner
1424, when can i fly from philadelphia to dallas on a saturday morning
1425, give me the continental flights from seattle
1426, what is fare code h
1427, ground transportation in baltimore
1428, show me the flights from pittsburgh to philadelphia
1429, what continental flights go from chicago to seattle before 10 am in the morning that have a meal
1430, show me the latest flight from denver to boston
1431, show me all flights between san francisco and philadelphia for september fifteenth
1432, what flights from toronto to philadelphia
1433, show me wednesday afternoon flights from denver to san francisco
1434, how much does it cost to fly on american from dallas to baltimore
1435, what is the cheapest one way fare between boston and oakland
1436, how many fares are there one way from tacoma to montreal
1437, flight from denver to philadelphia
1438, i'd like to fly early tomorrow from columbus to minneapolis
1439, show me the economy flights from baltimore to dallas
1440, show me flights from pittsburgh to dc
1441, philadelphia to san francisco next week tuesday show the flights
1442, what is the earliest nonstop flight from washington to san francisco
1443, can you show me flights from baltimore to dallas
1444, flight from milwaukee to chicago
1445, what does ewr stand for
1446, i would like information on flights from dallas fort worth to atlanta on wednesday morning
1447, what are the dinner flights from indianapolis to san diego on wednesday may twelfth
1448, show me flights from denver to philadelphia
1449, show me delta flights from dallas to denver
1450, tell me about ground transportation at salt lake city
1451, where is general mitchell international located
1452, show me flights from philadelphia to denver on a monday
1453, us 3724 baltimore to philadelphia what is the fare
1454, okay can you tell me the flight cost between denver and atlanta
1455, what does ls stand for
1456, show me all flights from charlotte to columbus
1457, list the flights on friday afternoon from philadelphia to oakland
1458, describe pittsburgh airport
1459, show me the flights from love field
1460, i would like to book a flight for august twenty seventh from baltimore to san francisco on us air
1461, what flights land at general mitchell international
1462, i want all flights from atlanta to washington dc on thursday
1463, please show me fares from denver to san francisco
1464, what limousine service in toronto
1465, show me round trip fares from new york to miami
1466, how long does the ground transportation take from the salt lake city airport
1467, newark to cleveland daily
1468, i would like to schedule a flight on american airlines from philadelphia to san francisco that makes a stop in denver
1469, i'm interested in flying from boston to atlanta
1470, what airline is the flight originating in atlanta on november seventh at noon and arriving in san francisco at 210 pm
1471, list all flights from washington dc to tampa florida
1472, show me the flights from boston to dallas
1473, i want a flight from milwaukee to orlando one way leaving after 5 pm on wednesday
1474, which flights from pittsburgh to atlanta have the lowest coach class fares
1475, i'd like to know the earliest flight from boston to san francisco
1476, can you rent a car at stapleton international airport in denver
1477, okay i'd like a flight from boston to san francisco that leaves before 8 am
1478, i want to go from denver to atlanta round trip and make a stop at pittsburgh may i have the cheapest fare
1479, is there a delta flight from boston to denver
1480, i would like to fly delta airlines from atlanta to pittsburgh
1481, which flights are between boston and baltimore washington
1482, i would like to fly from denver to pittsburgh and atlanta
1483, on a breakfast flight from philadelphia to dallas via atlanta
