2204, what flights from st. paul to kansas city on friday with dinner served
2205, okay we're going from washington to denver first class ticket i'd like to know the cost of a first class ticket
2206, show me the flight schedule from pittsburgh to san francisco
2207, all flights from miami to new york
2208, what time does the tuesday morning 755 flight leaving washington arrive in san francisco
2209, show me all flights from atlanta to san francisco
2210, flights from kansas city to cleveland
2211, please give me all flights from dallas to oakland before noon
2212, what is the cost for a one way trip from pittsburgh to atlanta
2213, i need a listing of flights from kansas city missouri to salt lake city utah
2214, now i need another flight from las vegas to los angeles arriving also in the late afternoon what's available for that
2215, could you please tell me the cheapest fare from atlanta to boston
2216, what flights go from newark to boston after 5 pm
2217, show me the cheapest flights round trip from new york to san jose arriving in san jose before 7 pm
2218, i'd like to go from boston to atlanta sometime after 5 pm can you tell me the flights that could do that for me
2219, give me flights from atlanta to baltimore
2220, i need a flight from los angeles to pittsburgh on monday afternoon
2221, flights from montreal and phoenix to las vegas arriving at the same time
2222, i want to travel from philadelphia to san francisco with a stopover in dallas
2223, what is the most expensive flight from boston to dallas
2224, in dallas fort worth i would like information on ground transportation
2225, what flight do you have from atlanta to dallas on august twenty seventh in the morning
2226, show me the flights between atlanta and washington dc for wednesdays
2227, please show me the flights from boston to san francisco
2228, rental cars in boston
2229, i want a flight from montreal quebec to san diego california that leaves sunday
2230, please show me airlines with flight service from boston to denver from denver to philadelphia and from philadelphia to boston
2231, latest flight from houston to san jose
2232, list the earliest flights from atlanta to denver on a monday
2233, looking for a flight from dc to denver colorado
2234, flights from kansas city to cleveland on wednesday before 5 pm
2235, what kind of aircraft is used on the first class american airlines flight from philadelphia to san francisco with a dallas stopover
2236, please give me ground transportation information between dallas fort worth airport and downtown dallas
2237, which airlines fly between boston and baltimore
2238, show me the earliest flight on august second from boston to denver that serves a meal
2239, okay does twa have a flight from dallas to san francisco
2240, what is the round trip thrift fare on us air from boston to san francisco
2241, what is your last trip from washington to boston on august twenty seventh
2242, show me the flights from love field
2243, i'd like a flight on american from newark to nashville
2244, what is the least expensive flight from atlanta to boston
2245, are there any flights from milwaukee to tacoma on friday june eleventh
2246, what's the earliest flight from boston to philadelphia
2247, on usa air how many flights leaving oakland on july twenty seventh to boston nonstop
2248, and how can i get to the boston airport from downtown boston
2249, list all american airlines from milwaukee to phoenix on saturday
2250, i would like a flight from san francisco to pittsburgh on friday morning after 10 o'clock
2251, i would like to book a flight from denver to pittsburgh on july fifteenth i'd like it to be the cheapest flight
2252, what type of aircraft leaves from boston to washington dc at 9 am during a weekday
2253, list all afternoon flights on united airlines from san francisco to denver
2254, information on flights from atlanta to washington dc departing on thursday before 9 am
2255, what is the cheapest flight from san francisco to pittsburgh on sunday
2256, show me all the flights to baltimore from denver or philadelphia or pittsburgh
2257, are there any flights from chicago to minneapolis on saturday on continental
2258, i need a flight from philadelphia to dallas that stops in atlanta
2259, flights from ontario to orlando
2260, i would like to see flights from denver to philadelphia
2261, show me a list of ground transportation at boston airport
2262, does united airlines have flights between boston and denver
2263, how many flights has continental into and out of atlanta
2264, list the flights from toronto to salt lake city
2265, list the flights arriving in baltimore from denver on august third
2266, show me flights from baltimore to philadelphia please
2267, i need a flight from boston to san francisco leaving in the afternoon and arriving in the evening thank you
2268, show me the flights from washington to boston
2269, flights from philadelphia to oakland
2270, what is the fare for flights from denver to atlanta
2271, united airlines flights stopping in denver
2272, how far is the airport from san francisco
2273, what flights go from seattle to boston via minneapolis
2274, please list the flights from ontario california to orlando florida
2275, what types of ground transportation are there to san francisco airport
2276, please book for me a flight on twa from washington dc to san francisco earliest possible time
2277, list all flights from pittsburgh to philadelphia
2278, i'd like information on a flight from atlanta to denver a morning flight
2279, what ground transport is available in charlotte
2280, i want to fly from boston to san francisco via dallas fort worth on american airlines
2281, is there a red eye flight from san jose to nashville on wednesday the nineteenth of may
2282, i'm looking for flights from oakland to atlanta leaving before 1045 am
2283, show me the cheapest flights from atlanta to denver
2284, flights from denver to pittsburgh on thursday
2285, flights from cleveland to kansas city
2286, show me the flights from baltimore to oakland please
2287, show me the earliest flights from boston to denver on wednesday
2288, flight information from denver to san francisco
2289, show me the most expensive one way first class fare from baltimore to dallas
2290, what is the earliest morning flight from san francisco to boston
2291, what flights are there from boston to denver on monday morning
2292, which flights depart los angeles destination charlotte that leave on a monday morning
2293, i need a flight from atlanta to baltimore nonstop arriving at 7 pm please
2294, i need to get downtown from the denver airport
2295, show me the flights from boston to oakland
2296, i would like a ticket leaving from denver colorado to atlanta georgia with a stop in pittsburgh
2297, what airline is hp
2298, list daily flights from boston to oakland using continental airlines
2299, show me the flights from dulles to san francisco leaving after 6 pm
2300, now get me from pittsburgh to denver
2301, which airlines have first class flights today
2302, what flights are there arriving in chicago after 9 pm on continental
2303, what flights do you have in the morning of september twentieth on united airlines from pittsburgh to san francisco and a stopover in denver
2304, i need to fly between philadelphia and atlanta
2305, on continental flight 1765 from boston to san francisco what type of meal is served
2306, i'm in miami and i'd like to travel to las vegas on sunday
2307, show me all flights arriving to denver from boston
2308, what are all of the flights into and out of atlanta's airport
2309, what are the afternoon flights leaving from dallas to san francisco on american airlines
2310, what is american's last flight from boston to washington dc on july twenty first
2311, i would like information on flights from pittsburgh to baltimore arriving in baltimore before 10 am on thursday
2312, i'm sorry i want to book a flight from atlanta to denver colorado
2313, is there a round trip flight from baltimore to denver connecting in dallas
2314, what flights are currently available between boston and dallas fort worth
2315, what flights are from memphis to las vegas
2316, on april sixth i would like to book an early morning flight from tampa to charlotte
2317, list all flights from boston to san francisco with at least 3 stops
2318, what flights leave from phoenix to anywhere
2319, what flights are available sunday afternoon from oakland to dallas
2320, does american airlines offer a flight from boston to oakland which stops in denver
2321, i'd like to fly from tampa to montreal
2322, show me all all flights from pittsburgh to atlanta on wednesday which leave before noon and serve breakfast
2323, show me the flights from new york to los angeles with stop in milwaukee
2324, what is the earliest flight from philadelphia to dallas first class
2325, show me the cheapest fares from miami to new york leaving on a sunday
2326, i need to make reservations from denver to boston
2327, show me all the flights between dallas fort worth and either san francisco or oakland that depart between 5 and 7 pm
2328, atlanta to pittsburgh july twenty third
2329, please show me all round trip flights from burbank to tacoma
2330, i'd like to fly from boston to san francisco
2331, give me all the flights from new york to miami round trip
2332, i would like to travel from indianapolis to houston
2333, flight leaving chicago to nashville
2334, can you list the cheapest round trip fare from orlando to kansas city
2335, show me the flights from san diego to washington dc
2336, how much does it cost to fly eastern airlines from atlanta to boston
2337, what is the lowest cost for a one way ticket from boston to washington
2338, i would like a schedule of flights from san francisco to boston on wednesday
2339, tell me about the ground transportation in chicago
2340, show flights from dallas to san francisco
2341, what kind of ground transportation is there in dallas
2342, show me all flights and fares from dallas to san francisco
2343, give me the earliest flight tomorrow on northwest airlines from st. petersburg to milwaukee
2344, how many people fit on a 72s airplane
2345, what is the cheapest flight from washington to san francisco on friday
2346, what does restriction ap 80 mean
2347, show me all the united flights from boston to denver
2348, what is the distance from la guardia to new york's downtown
2349, what is the last flight from atlanta to boston
2350, show me all the flights from denver to baltimore arriving may tenth
2351, what is the least expensive one way ticket from atlanta to denver leaving on october twelfth
2352, list all nonstop flights from newark to tampa leaving on friday
2353, show me all flights on us airlines from boston to oakland california which leave after 11 o'clock am
2354, find the earliest flight from boston to oakland that serves breakfast
2355, show me flights from tampa to st. louis leaving before 10 am
2356, i'd like to know the price of first class seats from atlanta to san francisco
2357, i would like a flight from denver to pittsburgh
2358, first class fares from dallas to baltimore please
2359, what are the morning flights from nashville to tacoma and from nashville to san jose in the next two days
2360, i have two friends that would like to visit me on wednesday here in washington dc one of them lives in denver and the other lives in miami
2361, how about arrivals for american in atlanta
2362, what airlines fly between atlanta and san francisco
2363, show me the flights arriving in baltimore on june fifteenth leaving either from denver or dallas
2364, i want to fly from boston to dallas
2365, ground transportation philadelphia
2366, show me flights from denver to philadelphia arriving after 2100
2367, i need a flight from st. petersburg to miami for thursday
2368, then list the flights from atlanta to philadelphia early wednesday morning nonstop
2369, can you list costs of denver rental cars
2370, list the flights on wednesday from denver to washington arriving in washington between 1115 am and 1245 pm
2371, what airlines fly between san francisco and denver
2372, can you list all nonstop flights between st. petersburg and charlotte that leave in the afternoon and arrive soon after 5 pm
2373, now i'd like to see flights from detroit to st. petersburg on the next tuesday
2374, flights from cincinnati to dallas departing after 718 am
2375, how about flights leaving san francisco and arriving in boston for any day
2376, i would like information on twa flights from washington to philadelphia
2377, okay can you tell me the earliest flight which leaves from philadelphia to dallas
2378, what is restriction ap 55
2379, what ground transportation is there in oakland
2380, newark to cleveland
2381, what's the cheapest flight from denver to pittsburgh for both one way and round trip flights
2382, can you show me what flights are available on december sixteen going from oakland to dallas
2383, how can i go from minneapolis to long beach late tomorrow
2384, please show me flights from pittsburgh to boston on saturday morning after 8 am
2385, show me all prices of economy from baltimore to dallas
2386, what flights are available on dl from dallas to atlanta on monday morning
2387, i would like to fly from boston to baltimore
2388, what are the evening flights from atlanta to baltimore
2389, can i get a rental car in dallas
2390, what flights stop in atlanta before noon
2391, what are the flights from dallas to philadelphia
2392, what's the earliest flight from atlanta to boston
2393, what is ewr
2394, sure i'd like to determine what aircraft are use on july seventh leaving from boston and arriving in atlanta on july seventh
2395, flights from denver to chicago on sunday on continental
2396, i need to fly from nashville to tacoma first thing in the morning what is there
2397, i need a flight from philadelphia to denver
2398, okay i'd like a flight on us air from indianapolis to san diego in the afternoon what's available
2399, what is the fare going from baltimore to boston one way on november seventh
2400, what are the flights from denver to san francisco on tuesday october fifteenth
2401, what ground transportation is there from the airport in atlanta to downtown
2402, what is the last flight from dallas to boston
2403, flights from baltimore denver and pittsburgh to philadelphia where the round trip fare for each is less than 1000 dollars
2404, is there one stop with the us air boston leaving at 705 to atlanta
2405, i'm interested in flights from denver to pittsburgh
2406, what is the cheapest flight from long beach to memphis
2407, what ground transportation is available at the baltimore airport
2408, i need a flight from philadelphia to denver on sunday
2409, i would like a flight as early as possible in the day leaving from boston and to denver
2410, show me the flights from baltimore to seattle
2411, list the takeoffs and landings at general mitchell international
2412, airports in new york
2413, what is the cheapest fare for flights from boston to dallas
2414, flights between boston and philadelphia that arrive after 2 o'clock and before 5 o'clock on tuesday
2415, show me the flights from st. petersburg to toronto that arrive early in the morning
2416, please list the flights from baltimore to san francisco on fridays
2417, flight from nashville back to milwaukee
2418, i'd like a ticket on a plane from denver to atlanta i would like a coach class or lowest fare ticket
2419, please list am flights leaving san francisco boston
2420, boston ground transportation
2421, all right what do you have from oakland to philadelphia on wednesday
2422, what flights go from chicago to seattle on continental airlines on saturday
2423, how much does it cost to fly on delta from dallas to baltimore
2424, show me flights from baltimore to philadelphia
2425, i'd like a round trip ticket from los angeles to tacoma washington
2426, show me flights which leave from boston on july twenty second arriving in pittsburgh
2427, i would like a flight from philadelphia to dallas on american airlines
2428, i want to fly united airlines from boston to denver
2429, are there any airlines that have flights from boston to philadelphia that leave before 630 am
2430, show me flights from pittsburgh to san francisco on monday
2431, is there ground transportation between airport and downtown in boston
2432, i'm interested in flying from atlanta to boston i'd like to fly during breakfast
2433, ground transportation washington
2434, i need to catch an evening flight from boston to philadelphia on august first
2435, is the american flight 813 from boston to oakland a flight that goes straight through from boston to oakland without stopping at another city
2436, please list the flights from chicago to kansas city
2437, does any airline offer dc10 service between denver and boston
2438, what is the seating capacity of a boeing 767
2439, i want to travel from kansas city to st. paul and be there by dinnertime
2440, list all flights arriving in pittsburgh monday evening from san francisco that first class
2441, what flights from houston to milwaukee on friday on american airlines
2442, i would like to book a flight going from tampa to seattle on may twenty sixth i would like to stop in milwaukee on the way
2443, please list nonstop twa flights from las vegas to new york
2444, what is airline ff
2445, show me the flights going from pittsburgh to san francisco on monday
2446, show me all flights arriving to denver from oakland
2447, show me all the one way fares from tacoma to montreal
2448, please list the cost of all flights from philadelphia to denver airport next sunday
2449, i'd like to travel from boston to baltimore on us air 269 please tell me the times
2450, hi i want a round trip ticket to dallas
2451, i'm planning a trip to pittsburgh and i live in denver can you help me
2452, which airlines have daily flights from boston to dallas
2453, show me the flights from san francisco to newark that leave after 11 pm
2454, list flights leaving dallas on saturday and arriving in san francisco before 4 pm
2455, what is ff
2456, show me the flights from atlanta to philadelphia
2457, show me the flights from indianapolis to montreal
2458, what flights are there on sunday from seattle to chicago
2459, display all flights from st. petersburg and charlotte flights should leave after noon arrive after 5 pm nonstop flight
2460, what northwest flights stop in denver
2461, please give me a flight from pittsburgh to san francisco monday
2462, show me flights from pittsburgh to philadelphia
2463, what ground transportation is available from pittsburgh to downtown
2464, what is fare class h
2465, show me flights with first class reservations from san francisco to pittsburgh for monday
2466, what type of aircraft leaves from boston to washington dc before 9 am
2467, delta flights to dallas please
2468, show all airlines flying from pittsburgh to san francisco
2469, is there ground transportation in baltimore
2470, please list all flights on northwest and united airlines that go to denver
2471, information on american airlines flight from washington to philadelphia
2472, show me all the information about the flight from baltimore to dallas which is listed dl 1055 dl 405
2473, i need the cost of a ticket going from denver to baltimore a first class ticket on united airlines
2474, which nonstop flight from atlanta to oakland leaves in the afternoon and arrives at 5 pm
2475, i need a flight from philadelphia to boston
2476, what is the ground transportation in san diego
2477, is there a flight between san francisco and boston with a stopover in dallas fort worth
2478, show me all flights from baltimore to san francisco
2479, i would like a flight from philadelphia to dallas
2480, now i need a one way flight from pittsburgh to denver
2481, i want a flight from pittsburgh to los angeles that departs after 6 pm on thursday
2482, show me the flights from san francisco to boston
2483, how many first class flights are provided by american airlines
2484, show me all flights from pittsburgh to dallas
2485, what ground transportation is available at boston
2486, what is the earliest flight from boston to atlanta
2487, is there limo service at pittsburgh airport
2488, please show me flights which cost less than or equal to 466 dollars from new york to miami leaving on a tuesday
2489, give me return flights from philadelphia to san francisco for december third
2490, show me the latest flight from las vegas to denver
2491, list the flights from indianapolis to houston
2492, what is the earliest flight that eastern has between boston and washington
2493, give me the flights from kansas city to chicago leaving next wednesday arriving at chicago at about 7 pm
2494, all right what i'd like to do is find the cheapest one way fare from boston to denver
2495, show me a list of flights from pittsburgh to baltimore on august third
2496, what airlines are ac and as
2497, i'd like to see the flights from baltimore to philadelphia
2498, how much does a first class round trip ticket from cleveland to miami on us air cost
2499, what are all the flights into atlanta's airport
2500, show me flights from pittsburgh to philadelphia on wednesday morning
2501, what's the earliest flight leaving denver for pittsburgh
2502, tell me about flights from atlanta to charlotte north carolina leaving on monday and arriving in charlotte
2503, i want to fly from miami to chicago on american airlines and arrive at around 5 o'clock in the afternoon show me all flights
2504, what flights from st. louis to st. paul on thursday leaving after 10 am
2505, please list the flights from new york to los angeles
2506, are there any flights from denver to atlanta to pittsburgh
2507, what first class airplane goes from philadelphia to san francisco and stops in dallas in the afternoon on monday
2508, show flights from denver to oakland
2509, cheapest fare from indianapolis to seattle
2510, what's the cheapest flight from dallas to baltimore on december seventeenth
2511, show me the flights from dallas to boston
2512, please give me direct morning flights from pittsburgh to atlanta
2513, display all flights from baltimore to dallas on july twenty ninth
2514, what is the cost of a business class ticket going from boston to dallas leaving july first
2515, show me the continental flights with meals which depart seattle on sunday for chicago
2516, flights from pittsburgh to newark
2517, show me the flights from baltimore to boston
2518, i would like to book an early morning flight from tampa florida to charlotte north carolina on april sixth
2519, does united airlines provide any first class flights from denver to baltimore
2520, i would like a twa flight from atlanta to san francisco with a stopover in denver
2521, i'm looking for a flight from charlotte to las vegas that stops in st. louis hopefully a dinner flight how can i find that out
2522, denver to san francisco wednesday
2523, all flights from boston to washington dc
2524, nonstop flights seattle to kansas city
2525, is there a meal on delta flight 852 from san francisco to dallas fort worth
2526, list the flights that leave from philadelphia to atlanta early thursday morning before 8 am
2527, what are the flights from boston to baltimore leaving tomorrow
2528, show all united flights between boston and philadelphia
2529, what is the earliest flight from pittsburgh to san francisco
2530, what flights are there between washington dc and san francisco leaving washington after 6 pm on wednesday
2531, what flights go from denver to atlanta
2532, show me all the flights from toronto on nationair
2533, list all nonstop flights from los angeles to pittsburgh which arrive before 5 pm on tuesday
2534, i'd like to fly from columbus to nashville tomorrow morning
2535, i need flights that arrive in baltimore from pittsburgh
2536, all round trip flights between new york and miami business class fare
2537, find travel arrangements for a round trip flight from dallas to pittsburgh arriving after 8 pm
2538, give me american airlines from milwaukee to phoenix on saturday and sunday
2539, what types of ground transportation are available in philadelphia
2540, i would like a flight between boston and atlanta on any day at one in the afternoon
2541, please show me airlines with flights from denver to boston with a stopover in philadelphia
2542, like information on flights from san francisco to boston on thursday morning
2543, philadelphia to san francisco
2544, may i have a listing of flights from long beach california to columbus ohio on wednesday
2545, show me the cheapest flight arriving in baltimore on june fourteenth starting from dallas
2546, find a flight from toronto to san diego with a layover in san francisco on air canada
2547, what's the next smallest plane after a turboprop
2548, show me what fare codes symbols stand for
2549, what sort of ground transportation is there in washington dc
2550, what flights from st. paul to kansas city on friday with breakfast served
2551, list all round trip fares from phoenix to washington
2552, what fare codes cover flights from philadelphia to san francisco
2553, all flights from boston to washington dc on november eleventh
2554, what ground transportation is available in dallas
2555, what am flights are available from pittsburgh to boston
2556, i need a flight from baltimore to seattle
2557, what does co mean
2558, i'd like to fly from boston to san francisco could you find me the cheapest fare
2559, i want to fly from milwaukee to orlando
2560, and what are the flights from nashville to tacoma on the eighteenth again
2561, show flights from pittsburgh into san francisco arriving after 12 noon
2562, what does y mean
2563, what is a flight that goes from baltimore to san francisco and arrives at san francisco at 8 pm on a friday
