0, i want to fly from boston at 838 am and arrive in denver at 1110 in the morning
1, what flights are available from pittsburgh to baltimore on thursday morning
2, what is the arrival time in san francisco for the 755 am flight leaving washington
3, cheapest airfare from tacoma to orlando
4, round trip fares from pittsburgh to philadelphia under 1000 dollars
5, i need a flight tomorrow from columbus to minneapolis
6, what kind of aircraft is used on a flight from cleveland to dallas
7, show me the flights from pittsburgh to los angeles on thursday
8, all flights from boston to washington
9, what kind of ground transportation is available in denver
10, show me the flights from dallas to san francisco
11, show me the flights from san diego to newark by way of houston
12, what's the airport at orlando
13, what is the cheapest flight from boston to bwi
14, all flights to baltimore after 6 pm
15, show me the first class fares from boston to denver
16, show me the ground transportation in denver
17, all flights from denver to pittsburgh leaving after 6 pm and before 7 pm
18, i need information on flights for tuesday leaving baltimore for dallas dallas to boston and boston to baltimore
19, please give me the flights from boston to pittsburgh on thursday of next week
20, i would like to fly from denver to pittsburgh on united airlines
21, show me the flights from san diego to newark
22, please list all first class flights on united from denver to baltimore
23, what kinds of planes are used by american airlines
24, i'd like to have some information on a ticket from denver to pittsburgh and atlanta
25, i'd like to book a flight from atlanta to denver
26, which airline serves denver pittsburgh and atlanta
27, show me all flights from boston to pittsburgh on wednesday of next week which leave boston after 2 o'clock pm
28, atlanta ground transportation
29, i also need service from dallas to boston arriving by noon
30, show me the cheapest round trip fare from baltimore to dallas
31, show me all flights from new york to milwaukee on northwest airlines departing at 720 am
32, flights from new york to miami
33, please find a flight on delta from philadelphia to san francisco and give me the flight numbers
34, i need a flight from dallas to san francisco
35, fares and flights from pittsburgh to philadelphia
36, show me the airlines with first class flights
37, what are the flights from st. louis to burbank sunday evening
38, i'd like to arrange a flight from pittsburgh to atlanta
39, show flights from baltimore to san francisco between 6 pm and 8 pm on friday
40, how far is it from orlando airport to orlando
41, i would like a list of round trip flights between indianapolis and orlando florida for the twenty seventh and the twenty eighth of december
42, which airline has the most arrivals in atlanta
43, what airlines fly from new york to milwaukee to los angeles
44, pittsburgh to denver
45, which airlines serve atlanta
46, show me information on ground transportation for dallas
47, what is fare code h
48, show me all flights from boston to dallas fort worth both direct and connecting that arrive before noon
49, i need a flight from charlotte to newark leaving today evening
50, what are the times that you have planes leaving from san francisco going to pittsburgh on july seventh
51, flights from newark to cleveland
52, what flights go from boston to pittsburgh after 6 o'clock next tuesday
53, how much does the limousine service cost within pittsburgh
54, does us air have any flights out of atlanta to denver
55, what is booking class c
56, i'd like to know the shortest trip between boston and san francisco
57, i would like to see information for flights from san francisco leaving after 12 pm to pittsburgh on monday
58, what is the least expensive flight from denver to atlanta
59, i need to know information for flights leaving dallas on tuesday evening and returning to atlanta
60, what flight goes from denver to baltimore first class on united airlines arriving on may seventh
61, could you please tell me the airlines that fly from toronto to san diego
62, what flights do you have from burbank to tacoma washington
63, what is the ground transportation from philadelphia airport to the city proper
64, which airlines have first class flights today
65, find the latest flight from san francisco to atlanta that serves a meal
66, i would like to make a reservation for a flight to denver from philadelphia on this coming sunday
67, give me a list of airports in baltimore
68, show me flights from boston to denver on wednesday
69, show me the flights from boston to baltimore
70, what does fare code q mean
71, please give me the flights from san francisco to washington dc
72, i need information from denver to pittsburgh
73, from seattle to salt lake city
74, what is the earliest flight from boston to bwi that serves a snack
75, what types of aircraft does delta fly
76, what is the cost of a round trip flight from pittsburgh to atlanta beginning on april twenty fifth and returning on may sixth
77, give me the flights leaving denver august ninth coming back to boston
78, list all the flights that fly into general mitchell international
79, what flights fly from denver to san francisco on monday tuesday wednesday thursday and friday
80, list all flights from indianapolis to seattle
81, in flight meal oakland to philadelphia saturday
82, show me the flights on twa from atlanta in the morning
83, i want to find the first flight from baltimore to boston that serves a meal
84, of all airlines which airline has the most arrivals in atlanta
85, display all flights from baltimore to boston on july twenty ninth
86, i want to travel from atlanta to baltimore early in the morning first flight
87, i now need a flight from san jose to houston leaving on sunday the fourth
88, what are the flights available after 6 pm between san francisco and boston
89, what flights depart baltimore on friday and arrive in san francisco by 8 pm
90, show me flights from boston to san francisco
91, list the delta airlines flights from boston to philadelphia
92, show me the fares from dallas to san francisco
93, what nonstop flights between boston and washington arrive after 4 o'clock pm
94, what is the distance from los angeles international airport to los angeles
95, ground transportation in san jose
96, please tell me how many nonstop flights there are from boston to atlanta
97, on the earliest flight from san francisco to atlanta on delta is a meal being served
98, where does canadian airlines international fly
99, what flights from denver to pittsburgh arrive before 8 in the morning
100, find me the earliest flight from boston to atlanta
101, list nonstop flights from houston to dallas which arrive before midnight
102, show me the flights from boston to san francisco that stop in atlanta
103, show me flights to san francisco from philadelphia stopping in dallas
104, what city is the airport mco in
105, how much does it cost to rent a car in tacoma
106, show me flights from baltimore to dallas
107, show me a list of ground transportation at denver
108, i'd like a flight from columbus to phoenix stopping in cincinnati and serving dinner what's available
109, also show me flights from san francisco to pittsburgh on tuesday
110, show flights from dallas to oakland
111, give me the cheapest flight from charlotte to long beach
112, show me all flights from san francisco to pittsburgh
113, find me a flight on united from boston to san francisco with a stopover in denver
114, show me the last flight from love field
115, what flights go from newark to boston after 5 pm
116, what are all the flights from boston to dallas
117, what is the earliest flight departing san francisco and arriving in boston on november ninth
118, what is the earliest flight flying from pittsburgh to atlanta on july fifth
119, please list available flights for next saturday from philadelphia to dallas
120, what flights leave pittsburgh and arrive in los angeles after 5 pm on thursday
121, what is the transportation time from the airport to boston
122, which airline has the smallest plane leaving pittsburgh and arriving in baltimore on july fourth
123, what are the nonstop flights on america west or southwest air from kansas city to burbank on saturday may twenty two
124, what are the classes of service for american airlines
125, i would like to find out what flights there are on friday june eleventh from st. petersburg to milwaukee and then from milwaukee to tacoma thank you
126, all flights from boston to washington dc on november tenth
127, what are the flights from denver to san francisco
128, on the 8 am flight from san francisco to atlanta what type of aircraft is used
129, which flight is a one way fare at 329 dollars from denver to pittsburgh
130, what flights leave baltimore for boston after 6 o'clock on friday
131, okay i need to get a flight from houston to seattle
132, please list flights between denver and boston
133, find me the flights that are nonstop between boston and dallas that leave between 12 and 2 in the afternoon
134, i would like some information on flights leaving boston to atlanta
135, show me the latest nonstop flight from denver to washington dc
136, what are the flights from dallas to baltimore
137, i would like a nonstop flight from new york to las vegas on march second
138, no i want to go from denver to oakland
139, show me all the night fares between philadelphia and san francisco
140, what kinds of ground transportation is available in dallas fort worth
141, can you show me economy class one way fares for flights from oakland to dallas on december sixteenth
142, what is fare code qw
143, i'd like a flight on july ninth from orlando to kansas city in the afternoon
144, what are the coach fares from charlotte to la wednesday night
145, is there ground transportation available in denver
146, show me flights from philadelphia to oakland on friday
147, i would like to know the flights available from boston to denver arriving in denver by 8 o'clock wednesday morning
148, i would like to fly the cheapest rate available from pittsburgh to atlanta on wednesday morning
149, list the flight from philadelphia to san francisco on american airlines
150, flights from memphis to las vegas on sunday
151, what is the first flight from atlanta to boston on thursday september fifth that leaves after 8 am
152, what is the first class fare on united flight 352 from denver to boston
153, flight from philadelphia to dallas arriving before 4 pm on saturday
154, list flights tomorrow from san diego to phoenix
155, show me all flights from san francisco to washington dc area
156, sure i want to go from philadelphia to dallas
157, show me all the united airlines flights leaving dallas
158, can you list all the flights between phoenix and las vegas
159, list all flights from baltimore to philadelphia
160, round trip flights from minneapolis to san diego coach economy fare
161, i want to fly from boston to denver and i don't want any stopovers and i'd like to fly only during the afternoon
162, flights from denver to baltimore between 10 am and 2 pm
163, show me the flights from denver to atlanta
164, what flights are there on delta from boston to dallas
165, what kind of ground transportation can you offer me in seattle
166, leaving washington going to san francisco the latest flight
167, show me the flights available from atlanta to baltimore leaving atlanta in the morning
168, round trip fares new york to san jose
169, which flights are serviced by american airlines
170, how do i get from pittsburgh airport to downtown pittsburgh
171, does midwest express serve charlotte
172, what flights from houston to milwaukee on friday in the evening on american airlines
173, what is the earliest flight going from san francisco to dallas on monday august nineteenth
174, what flights from atlanta to st. louis on tuesday arriving around 230 pm
175, i need a flight from kansas city to chicago that leaves wednesday and arrives in chicago around 7 pm
176, i would like information on any flights from pittsburgh to san francisco leaving thursday evening
177, i need a cheap flight from baltimore to san francisco
178, what is the cost of a first class ticket from baltimore to dallas
179, what is the economy thrift fare from boston to washington
180, list the nonstop flights early tuesday morning from dallas to atlanta
181, what is the earliest flight you have that leaves philadelphia to dallas
182, are there any flights from dallas fort worth to boston leaving before 10 am
183, show me all the flights to baltimore after 6 o'clock pm
184, i need a return flight from philadelphia to boston
185, united airlines flights stopping in denver before noon
186, show me the car rentals in baltimore
187, what flights go from newark to boston after 1024 in the morning
188, shortest evening flight from tampa to cincinnati
189, how much time does it take to go between the airport and downtown by ground transportation in dallas
190, flights from boston to pittsburgh
191, i'd like to fly continental airlines between boston and philadelphia
192, i would like to book a flight on continental airlines from chicago to seattle on june first
193, all flights from pittsburgh to dallas round trip after 12 pm less than 100
194, show me flights on sunday going from san francisco to boston nonstop first class leaving after 12 noon
195, from las vegas to phoenix
196, show me flights from pittsburgh to atlanta on monday afternoon
197, show me the flight with the smallest seating capacity which leaves pittsburgh and arrives in baltimore on june fourteenth
198, show all flights from boston to denver on july thirty first
199, are there any flights before 12 noon on june fifteenth from long beach to columbus
200, list daily flights from boston to atlanta
201, on a flight from san francisco to atlanta that leaves before 8 am is there such a flight
202, on united airlines give me the flight times from boston to dallas
203, ground transportation minneapolis
204, show me airline abbreviations
205, how many flights does delta have with a class of service code f
206, please list all the arriving and departing flights from general mitchell international
207, i would like to see the flights from denver to philadelphia please
208, does eastern airlines fly early in the morning between logan and bwi
209, what flights leave phoenix on american airlines
210, can you list all the airlines that have flights from boston to san francisco
211, flights from nashville to orlando daily
212, show me first class flights from pittsburgh to san francisco on friday
213, i need the earliest flight from denver to boston that serves dinner
214, from toronto to atlanta in the afternoon
215, please list the friday afternoon flights from san jose to dallas on american airlines
216, is there ground transportation in boston from the airport
217, show first flight from pittsburgh to atlanta on wednesday
218, i'm sorry i wanted to fly twa is there a flight between oakland and boston with a stopover in dallas fort worth on twa
219, show me all flights from san francisco to la guardia nonstop
220, what flights are there from pittsburgh to los angeles
221, what kind of ground transportation is there in washington dc
222, what is the least expensive flight available from dallas fort worth to san francisco
223, what does the fare code f mean
224, what's the most expensive way i can fly to washington
225, what flights from houston to milwaukee on friday on american airlines
226, what is the schedule of ground transportation from the airport in philadelphia into downtown
227, show me a list of flights from san francisco to boston for august thirtieth
228, show me the least expensive flight from miami to cleveland on sunday after noon
229, how much does it cost to go from downtown to logan airport
230, what flights are there from newark to tampa
231, i want a flight from philadelphia to dallas that at least has one stop
232, show flights from denver to oakland arriving between 12 and 1 o'clock
233, what is the fare from san francisco to dallas fort worth on delta flight 852
234, flights from newark new jersey to cleveland ohio
235, give me flights from denver to baltimore
236, show the flights from denver to san francisco
237, show me flights denver to washington dc on thursday
238, please list the thursday morning flights from st. louis to st. paul
239, what flight do you have from pittsburgh to san francisco on the morning of august twenty seventh
240, what are the flights from boston to atlanta
241, what flights from baltimore to san francisco arrive before 8 pm in san francisco
242, show me the flights from pittsburgh to san francisco for thursday night or friday
243, get me a first class flight on american to san francisco on tuesday next week
244, ground transportation in westchester county
245, what flights are there from atlanta to baltimore
246, i'd like to fly from dallas to san francisco at approximately 615 pm
247, list the fares of us air flights from boston to philadelphia
248, list flights from phoenix to detroit on thursday june twenty fourth
249, what flights from miami to indianapolis on sunday
250, now show me the flights from memphis to cleveland
251, can you give me information on all the flights from san francisco no from pittsburgh to san francisco on monday
252, could you find me a flight from boston to san francisco that stops in denver
253, flights from cleveland to miami
254, give me the flights from pittsburgh to los angeles thursday evening
255, please list all of the flights leaving atlanta heading to baltimore after 8 pm wednesday and before 9 am thursday
256, show me flights from seattle to san francisco that leave after 5 pm
257, show me the flights that go from tacoma to miami
258, which airline can fly me from atlanta to denver to san francisco
259, are there any flights from denver to pittsburgh with stops in atlanta
260, list all the flights that arrive at general mitchell international
261, what is fare code h
262, what flights from salt lake city to new york city arrive next saturday before 6 pm
263, flights from nashville to seattle
264, show me fares from seattle to minneapolis
265, i need a flight from boston to san francisco via dallas fort worth
266, i'd like an afternoon flight from atlanta to san francisco with a stopover in denver arriving i'd say about mealtime
267, show me the most expensive one way flight from detroit to westchester county
268, show me the flights from baltimore to philadelphia
269, from denver to washington dc on monday november eleventh 1991
270, please list all the flights from boston to denver which serve meals
271, list aircraft types that fly between boston and san francisco
272, what does fare code qw mean
273, i'm interested in a flight on american airlines from dallas to washington
274, give me flights from pittsburgh to baltimore
275, how much is a round trip fare from indianapolis to seattle
276, what is the cheapest flight from long beach to memphis
277, which airline provides business class flights
278, pittsburgh to denver
279, which airlines fly between boston and pittsburgh
280, list the flights arriving in atlanta from baltimore before noon on august fourth
281, give me the flights for american airline from philadelphia to dallas
282, i need a flight this sunday from miami to las vegas and i would prefer a morning flight
283, flights from boston to pittsburgh
284, which flights go from pittsburgh to atlanta in the evening
285, show me the fares from dallas to san francisco
286, give me american airlines flights from milwaukee to phoenix on saturday and on sunday
287, list all flights that leave from baltimore or denver or pittsburgh and arrive in philadelphia
288, show me the flights from baltimore to oakland
289, show me the earliest flight from denver to las vegas
290, show me flights from milwaukee to orlando on wednesday night
291, may i have a listing of flights from milwaukee to tacoma washington departing in the evening
292, what morning flights do you have between oakland and denver
293, i'd like a flight from washington that stops in denver and goes on to san francisco
294, show me all flights from pittsburgh to baltimore tomorrow
295, all one way flights between boston and philadelphia
296, what flights go to san francisco from boston
297, what flights are there from san francisco to philadelphia daily with economy class
298, first flights from pittsburgh to atlanta on a thursday
299, show me the flights from baltimore to atlanta
300, tell me about flights from toronto to salt lake city leaving after 530 pm
301, show me the flights from indianapolis to orlando with round trip fares less than 1288
302, i need a flight from boston to pittsburgh that leaves early in the morning
303, what is the first flight from atlanta to baltimore that serves lunch
304, show me the flights from pittsburgh to baltimore
305, all flights from denver to philadelphia
306, oakland to philadelphia saturday
307, give me the earliest flight tomorrow on united airlines from st. petersburg to milwaukee
308, show me flights on monday from philadelphia to boston after 7 am
309, show me all the flights leaving baltimore
310, show me the flights from philadelphia to boston
311, is there a plane from boston to washington
312, i need to go from boston to atlanta and back in the same day find me the earliest flight from boston
313, what are flights between boston and pittsburgh on august tenth
314, what are the schedule of flights from boston to san francisco for august first
315, show me one way flights from milwaukee to orlando wednesday
316, show me all flights from pittsburgh to baltimore tomorrow which serve a meal
317, give me flights on american airlines from milwaukee to phoenix
318, show all flights from pittsburgh to san francisco
319, i wish to fly from boston to washington please find an airline for me
320, please list the flights from dallas fort worth to dc baltimore on july twenty third
321, which flights from memphis to tacoma also stop in los angeles
322, show me the flights on tuesday morning from charlotte to baltimore
323, i need 2 first class tickets from dallas fort worth to san francisco
324, are there any flights from philadelphia to dallas which stop in atlanta
325, flights to baltimore
326, what does mco stand for
327, what is the least expensive way to fly from philadelphia to san francisco
328, list all nonstop flights from los angeles to pittsburgh before 5 pm on tuesday
329, how many booking classes are there
330, flight numbers from columbus to minneapolis tomorrow
331, give me the continental flights from chicago to seattle on friday
332, what are the united airlines flights between baltimore and denver on august twelfth
333, show me the flights next tuesday between philadelphia and san francisco
334, find a flight on american airlines from boston to san francisco that makes a stopover in denver
335, show me the fares on all flights round trip from pittsburgh to oakland
336, what's the difference between fare code q and fare code f
337, flights from cincinnati to salt lake city
338, ground transportation denver
339, show me flights from denver to washington dc on wednesdays
340, find a flight between denver and oakland the flight should be in the afternoon and arrive close to 5 pm the flight should be nonstop
341, show me all flights from atlanta to washington with prices
342, flights between new york and miami
343, please list the monday morning flights from kansas city to atlanta
344, list all american airlines flights from phoenix to milwaukee which arrive on wednesday after 4 pm
345, what round trip tickets are there from cleveland to miami on us air that arrive before 4 pm
346, i'd like to go from boston to denver at 9 o'clock saturday night
347, show me the northwest flights from detroit to st. petersburg
348, what is the available ground transportation between the airport in denver and downtown
349, on may four atlanta to denver delta flight 257
350, show me all flights from indianapolis
351, which airlines have flights between philadelphia and pittsburgh
352, which are the flights from denver to baltimore or washington dc
353, list the number of flights leaving boston for dallas fort worth before 9 am in the morning
354, are there delta flights leaving atlanta
355, can you list all round trip flights from orlando to kansas city and then to minneapolis
356, i would like to find a flight from kansas city to salt lake city on delta and arriving at about 8 o'clock in the evening could you please tell me the aircraft and the flight number thank you
357, i would like a flight from washington to boston leaving at 230 on august twentieth
358, how much is a flight from washington to boston
359, show me all flights from orlando to san diego on a boeing 737
360, what flights are there on sunday from seattle to minneapolis
361, where is mco
362, show me all flights from pittsburgh to atlanta
363, which united airlines flight flies across this continent and leaves from boston goes to dallas and makes a stopover in philadelphia
364, list daily flights of united airline from denver to baltimore with first class service
365, show me flights from pittsburgh to atlanta on monday morning
366, all flights phoenix to sfo
367, i want to travel from washington dc to philadelphia on tuesday morning
368, what is the fare going from atlanta to boston one way on november seventh
369, is there a flight on american airlines from boston to denver
370, what flights are available from san francisco to pittsburgh on thursday evening
371, do you have an afternoon flight leaving in the afternoon going from boston to san francisco with a stopover in dallas
372, show the flights from pittsburgh to san francisco again on monday
373, show me a list of flights on american airlines from boston to dc on july twenty second
